id,ground_truths,query,original_answers,reranked_answers
4355,[8761],Which gene or protein facilitates the symbiotic interaction within the pathway that inserts viral DNA into the host genome and possesses the ability to bind nonspecifically to double-stranded DNA?,"[8761, 9143, 2629, 1531, 4481, 572, 4961, 6828, 3158, 3755, 1063, 4335, 8830, 2761, 4238, 4165, 7091, 59304, 2887, 10978]","[8761, 9143, 2629, 1531, 4481, 572, 4961, 6828, 3158, 3755, 1063, 4335, 8830, 2761, 4238, 4165, 7091, 59304, 2887, 10978]"
10715,"[67302, 68618, 63824, 63921, 63826, 66747, 68030]",Which anatomical structures lack the expression of genes or proteins involved in the negative regulation of organ development?,"[63180, 64876, 65138, 64799, 63584, 64338, 63466, 63235, 66760, 66747, 64778, 63826, 63680, 68030, 68618, 67341, 63372, 63379, 63407, 64427]","[63180, 64876, 65138, 64799, 63584, 64338, 63466, 63235, 66760, 66747, 64778, 63826, 63680, 68030, 68618, 67341, 63372, 63379, 63407, 64427]"
2803,"[14792, 14793, 15429]",Could you recommend any medications that target the TUBB1 gene/protein and inform me about potential side effects like myelosuppression or neurotoxicity?,"[14793, 14792, 16026, 16029, 16028, 15025, 16027, 15526, 15429, 15523, 16030, 14606, 14868, 16753, 14948, 20402, 15597, 19612, 15077, 15017]","[14793, 14792, 16026, 16029, 16028, 15025, 16027, 15526, 15429, 15523, 16030, 14606, 14868, 16753, 14948, 20402, 15597, 19612, 15077, 15017]"
583,[1032],"Could you find a gene or protein that interacts with the ATR activation pathway during replication stress, has significant homology with fission yeast's Rad9, and possesses 3' to 5' exonuclease activity linked to DNA damage detection and repair?","[1032, 69, 9020, 395, 57049, 2838, 3286, 3187, 2306, 4834, 8969, 2249, 6965, 3966, 7442, 2094, 1955, 8873, 57624, 11373]","[1032, 69, 9020, 395, 57049, 2838, 3286, 3187, 2306, 4834, 8969, 2249, 6965, 3966, 7442, 2094, 1955, 8873, 57624, 11373]"
733,[4074],Please find genes or proteins that interact with TNF receptor superfamily members associated with the non-canonical NF-kB pathway and also connect with CISD2 through protein-protein interactions.,"[1419, 8906, 1654, 189, 10789, 1822, 1677, 443, 2429, 8587, 6587, 4835, 6230, 536, 7497, 63099, 3605, 34623, 2148, 2329]","[1419, 8906, 1654, 189, 10789, 1822, 1677, 443, 2429, 8587, 6587, 4835, 6230, 536, 7497, 63099, 3605, 34623, 2148, 2329]"
2069,[38570],Could you help me identify the condition associated with cerebellar hemisphere malformation that is hereditary and might explain developmental issues in the posterior brain region?,"[27402, 31085, 28601, 31829, 31878, 27344, 32200, 29016, 29926, 33006, 30428, 32657, 32195, 28470, 27376, 39359, 98231, 29660, 38540, 98066]","[27402, 31085, 28601, 31829, 31878, 27344, 32200, 29016, 29926, 33006, 30428, 32657, 32195, 28470, 27376, 39359, 98231, 29660, 38540, 98066]"
1408,[5991],"I need to find a gene or protein that interacts with USH1C through PPI, is expressed in leg muscles, helps anchor protocadherins to actin, and is involved in gathering intermicrovillar adhesion complex components.","[8183, 12888, 13068, 419, 22024, 6135, 9659, 35033, 5991, 58413, 22023, 9108, 33881, 3613, 8243, 10511, 11978, 1391, 58416, 58403]","[8183, 12888, 13068, 419, 22024, 6135, 9659, 35033, 5991, 58413, 22023, 9108, 33881, 3613, 8243, 10511, 11978, 1391, 58416, 58403]"
8335,"[14174, 14229, 14262]",Which keratolytic medication utilizes the same gene or protein for transport as Polythiazide?,"[14331, 14283, 14233, 14276, 14352, 14668, 14217, 15847, 19111, 20267, 15465, 14064, 14729, 14262, 14258, 16705, 20751, 16788, 15736, 20325]","[14331, 14283, 14233, 14276, 14352, 14668, 14217, 15847, 19111, 20267, 15465, 14064, 14729, 14262, 14258, 16705, 20751, 16788, 15736, 20325]"
10947,"[56174, 56099, 124245, 56150]",Which cellular structures are engaged in interactions with genes or proteins that Aeruginosin 98-B affects?,"[124748, 124619, 125162, 124802, 126967, 124858, 56086, 55599, 127042, 56230, 125102, 125445, 56191, 126344, 126544, 126913, 125248, 125268, 55689, 124594]","[124748, 124619, 125162, 124802, 126967, 124858, 56086, 55599, 127042, 56230, 125102, 125445, 56191, 126344, 126544, 126913, 125248, 125268, 55689, 124594]"
3891,[4447],Can you identify a gene or protein involved in atrial fibrillation that also has a role in ubiquitin ligase binding and is active in the rapid repolarization phase of cardiac activity?,"[10417, 189, 357, 58657, 1532, 7695, 1221, 8068, 8919, 10608, 7198, 412, 2392, 7324, 34962, 34250, 34603, 3755, 9020, 56552]","[10417, 189, 357, 58657, 1532, 7695, 1221, 8068, 8919, 10608, 7198, 412, 2392, 7324, 34962, 34250, 34603, 3755, 9020, 56552]"
5086,[36062],"What possible medical conditions could be linked to femoral vein thrombophlebitis and phlebitis, considering they are hereditary in my family?",[],[]
2827,[39391],"Could you provide information on hereditary diseases linked to 'acheiria, unilateral'? I'm wondering if it could explain the symptoms I'm having.","[28165, 32152, 30080, 31268, 27376, 28798, 32073, 28987, 27178, 32260, 32373, 30397, 29669, 33570, 30736, 98312, 98313, 39391, 31817, 28430]","[28165, 32152, 30080, 31268, 27376, 28798, 32073, 28987, 27178, 32260, 32373, 30397, 29669, 33570, 30736, 98312, 98313, 39391, 31817, 28430]"
9578,[16751],"Are there any pharmaceutical agents designed to regulate pH balance that also interact with, or have an effect on, the genes or proteins associated with 6,7-dihydropteridine reductase activity?","[17010, 16995, 14352, 17972, 14586, 18193, 16751, 16723, 14656, 14877, 14012, 19246, 14889, 19244, 14911, 15928, 18344, 16764, 16273, 21647]","[17010, 16995, 14352, 17972, 14586, 18193, 16751, 16723, 14656, 14877, 14012, 19246, 14889, 19244, 14911, 15928, 18344, 16764, 16273, 21647]"
5727,[43],Identify proteins or genes that interact with NEK11 and share an association with a mutual disease.,"[34836, 3803, 34837, 1876, 2329, 3348, 3523, 518, 1493, 7154, 6428, 2573, 1785, 7286, 177, 6415, 13154, 35080, 6097, 553]","[34836, 3803, 34837, 1876, 2329, 3348, 3523, 518, 1493, 7154, 6428, 2573, 1785, 7286, 177, 6415, 13154, 35080, 6097, 553]"
2884,[38662],Which disease falls under normal pressure hydrocephalus and is linked to the THAS gene or its protein product?,"[36429, 84196, 38662, 33484, 27971, 94798, 38535, 29207, 33221, 27770, 32838, 33561, 31497, 32177, 30790, 28135, 30060, 31457, 98546, 27969]","[36429, 84196, 38662, 33484, 27971, 94798, 38535, 29207, 33221, 27770, 32838, 33561, 31497, 32177, 30790, 28135, 30060, 31457, 98546, 27969]"
6231,[62756],"Identify pathways associated with the ""Release of Hedgehog protein without cholesterol"" (Hh-Np) from secreting cells that also interact with a common gene or protein.","[128536, 62756, 128719, 62761, 62559, 62981, 129169, 62757, 128115, 128717, 62770, 62560, 62777, 127814, 128042, 62978, 129168, 62424, 128718, 62617]","[128536, 62756, 128719, 62761, 62559, 62981, 129169, 62757, 128115, 128717, 62770, 62560, 62777, 127814, 128042, 62978, 129168, 62424, 128718, 62617]"
7256,"[14016, 14017, 14049, 14019, 14048, 14021, 14050, 14023, 14024, 14028, 14030, 14031]","Is there a shared genetic or protein transporter mechanism between Fluorometholone and Dexamethasone, both being potent corticosteroid medications frequently prescribed in eye care practices?","[8974, 509, 11611, 35375, 792, 35321, 13807, 34891, 13122, 13738, 10901, 3894, 8501, 21958, 9181, 7880, 2430, 34059, 1424, 8300]","[8974, 509, 11611, 35375, 792, 35321, 13807, 34891, 13122, 13738, 10901, 3894, 8501, 21958, 9181, 7880, 2430, 34059, 1424, 8300]"
6603,[62838],Identify a biological pathway associated with the Formation of the Cornified Envelope that also demonstrates interaction with a mutual gene or protein.,"[128342, 129365, 128854, 128058, 127614, 128853, 62669, 128340, 128979, 62809, 62348, 128980, 127615, 62747, 62996, 128840, 127657, 62575, 128195, 62723]","[128342, 129365, 128854, 128058, 127614, 128853, 62669, 128340, 128979, 62809, 62348, 128980, 127615, 62747, 62996, 128840, 127657, 62575, 128195, 62723]"
8625,"[14209, 14210, 14403, 14181, 14218, 14254, 14256, 14484, 14264, 14138, 14428]",Which medication shares a gene or protein transporter with Efavirenz and additionally serves as a reverse transcriptase inhibitor?,"[14209, 15566, 15056, 14184, 14254, 14346, 14296, 14138, 14319, 15889, 15853, 14403, 15034, 14967, 14218, 15588, 14484, 15619, 14375, 15130]","[14209, 15566, 15056, 14184, 14254, 14346, 14296, 14138, 14319, 15889, 15853, 14403, 15034, 14967, 14218, 15588, 14484, 15619, 14375, 15130]"
1208,[99571],Which disease associated with neoplastic syndrome aggressively invades the chest skeleton early on?,"[37323, 96466, 37505, 35785, 36161, 37037, 36971, 37983, 37022, 98587, 37346, 35633, 35942, 36826, 97369, 36029, 36053, 96069, 37694, 35468]","[37323, 96466, 37505, 35785, 36161, 37037, 36971, 37983, 37022, 98587, 37346, 35633, 35942, 36826, 97369, 36029, 36053, 96069, 37694, 35468]"
7047,"[2089, 897]","Is there an interaction between the gene/protein responsible for actin binding and disassembly, mediated by actin depolymerization factor 2, and the gene/protein implicated in the synthesis of 5-Phosphoribose 1-diphosphate?","[11344, 21977, 9192, 6992, 12475, 4569, 958, 9439, 4914, 7709, 12782, 468, 3037, 58273, 56482, 4643, 7103, 12910, 8741, 1028]","[11344, 21977, 9192, 6992, 12475, 4569, 958, 9439, 4914, 7709, 12782, 468, 3037, 58273, 56482, 4643, 7103, 12910, 8741, 1028]"
6434,"[14465, 14049, 14147, 14177, 14410, 14316, 14385, 14420, 14461, 14422, 14233, 14556, 14173, 14238]","Could you identify a medication facilitated by genetic or proteomic agents that engage with the endoplasmic reticulum and exhibits a half-life ranging from 12 to 17 hours, which plays a role in controlling the intracellular protein processing and trafficking?","[14241, 14449, 14411, 14452, 14206, 14301, 14462, 14456, 14580, 14347, 14583, 14380, 14425, 14185, 14286, 20264, 17539, 15858, 15281, 14408]","[14241, 14449, 14411, 14452, 14206, 14301, 14462, 14456, 14580, 14347, 14583, 14380, 14425, 14185, 14286, 20264, 17539, 15858, 15281, 14408]"
3501,"[13501, 1151]","Which gene on chromosome 4, known to interact with PALS2 protein and expressed in multicellular organisms, encodes a protein located between 69,969 and 70,151 base pairs?","[7939, 10404, 79833, 12140, 80520, 79843, 58282, 82210, 80209, 6700, 77148, 57263, 80264, 58281, 57291, 63089, 77645, 81727, 77328, 58315]","[7939, 10404, 79833, 12140, 80520, 79843, 58282, 82210, 80209, 6700, 77148, 57263, 80264, 58281, 57291, 63089, 77645, 81727, 77328, 58315]"
10076,[14012],Which medications are associated with genes or proteins that engage with the Golgi apparatus interior?,"[15017, 17983, 15858, 21195, 15226, 17127, 20196, 15552, 19592, 20973, 21100, 21225, 20511, 14207, 15280, 19617, 21645, 18634, 17665, 17418]","[15017, 17983, 15858, 21195, 15226, 17127, 20196, 15552, 19592, 20973, 21100, 21225, 20511, 14207, 15280, 19617, 21645, 18634, 17665, 17418]"
7527,"[29182, 33534]",Which multi-organ systemic diseases are linked to the PXK gene and have contraindications with the use of Pyridoxine?,"[29182, 33534, 31711, 31502, 35751, 39531, 35764, 83867, 36214, 35565, 33679, 36253, 83832, 27933, 27878, 32707, 38759, 28359, 84266, 30591]","[29182, 33534, 31711, 31502, 35751, 39531, 35764, 83867, 36214, 35565, 33679, 36253, 83832, 27933, 27878, 32707, 38759, 28359, 84266, 30591]"
9158,[3209],Which gene or protein is simultaneously not expressed in the placenta and the superior frontal gyrus?,"[3209, 6265, 13470, 77335, 10696, 13677, 11638, 7716, 12523, 7453, 60121, 6213, 34525, 1768, 4493, 60095, 4116, 6179, 9805, 77495]","[3209, 6265, 13470, 77335, 10696, 13677, 11638, 7716, 12523, 7453, 60121, 6213, 34525, 1768, 4493, 60095, 4116, 6179, 9805, 77495]"
1558,[94622],What conditions similar to malignant mesothelioma could affect the heart's outer lining and cause abnormal symptoms?,"[94622, 96621, 37983, 37981, 97367, 95857, 37694, 95827, 36621, 36973, 96343, 99834, 97368, 36511, 30725, 95559, 96342, 37982, 32612, 96923]","[94622, 96621, 37983, 37981, 97367, 95857, 37694, 95827, 36621, 36973, 96343, 99834, 97368, 36511, 30725, 95559, 96342, 37982, 32612, 96923]"
6250,[9652],Which gene or protein is not expressed in the fallopian tube and is also non-existent in the metanephric glomerular tissue?,"[34036, 9652, 6157, 79070, 77443, 78053, 11599, 60247, 3470, 13462, 22000, 82457, 5188, 4344, 10084, 2850, 13631, 1558, 68, 1781]","[34036, 9652, 6157, 79070, 77443, 78053, 11599, 60247, 3470, 13462, 22000, 82457, 5188, 4344, 10084, 2850, 13631, 1558, 68, 1781]"
6159,[2492],Which gene/protein is not expressed in both the renal tissues and the medial segment of the globus pallidus?,"[5798, 9197, 8556, 56495, 2354, 13481, 8435, 1619, 58420, 11943, 58590, 35338, 8557, 4174, 3643, 79070, 3470, 5188, 5581, 13733]","[5798, 9197, 8556, 56495, 2354, 13481, 8435, 1619, 58420, 11943, 58590, 35338, 8557, 4174, 3643, 79070, 3470, 5188, 5581, 13733]"
10698,[128250],Identify pathways associated with the metabolism of polyamines which also exhibit interaction with identical genes or proteins.,"[62643, 129086, 128906, 128911, 129079, 129076, 128274, 62677, 127797, 128910, 127636, 128898, 127633, 62433, 128341, 128252, 127714, 62955, 62580, 62685]","[62643, 129086, 128906, 128911, 129079, 129076, 128274, 62677, 127797, 128910, 127636, 128898, 127633, 62433, 128341, 128252, 127714, 62955, 62580, 62685]"
4344,[3007],"Can you find a gene or protein that interacts with the sphingolipid biosynthesis pathway, is involved in dihydrosphingosine-1-phosphate phosphatase activity, and contributes to the chemotactic response to EGF?","[3007, 59808, 13269, 12461, 3890, 11103, 34650, 58124, 58112, 12964, 8951, 58358, 58143, 59377, 22003, 12597, 5580, 59898, 2736, 3784]","[3007, 59808, 13269, 12461, 3890, 11103, 34650, 58124, 58112, 12964, 8951, 58358, 58143, 59377, 22003, 12597, 5580, 59898, 2736, 3784]"
5449,"[59912, 12045, 9317]","I'm looking for a gene or protein that modulates the Glutathione synthesis and recycling pathway, catalyzes the transformation of amino acids into different metabolites, and inhibits the growth of cancer cells, particularly with tumor-suppressing effects in gastric cancer.","[58285, 9219, 10154, 9317, 56966, 10735, 59912, 5101, 5871, 13624, 14000, 4181, 1540, 1270, 12045, 9893, 10247, 59318, 1497, 3796]","[58285, 9219, 10154, 9317, 56966, 10735, 59912, 5101, 5871, 13624, 14000, 4181, 1540, 1270, 12045, 9893, 10247, 59318, 1497, 3796]"
1828,[28822],Which autosomal recessive disease is associated with the AEBP1 gene?,"[94720, 28822, 31724, 27823, 33478, 32434, 27999, 30144, 27542, 30050, 32964, 28099, 35958, 30175, 27622, 31086, 27567, 99893, 35458, 27162]","[94720, 28822, 31724, 27823, 33478, 32434, 27999, 30144, 27542, 30050, 32964, 28099, 35958, 30175, 27622, 31086, 27567, 99893, 35458, 27162]"
8161,[1147],Which genes or proteins are found to be expressed in the nasopharyngeal tissue but not in the parietal lobe of the brain?,"[1147, 3176, 446, 352, 721, 743, 6373, 7280, 5877, 7947, 12627, 12749, 1559, 4900, 4966, 79070, 83456, 77318, 80165, 77617]","[1147, 3176, 446, 352, 721, 743, 6373, 7280, 5877, 7947, 12627, 12749, 1559, 4900, 4966, 79070, 83456, 77318, 80165, 77617]"
9020,[27400],Which disorders linked to Ketosis may lead to cardiomyopathy and hypoketotic hypoglycemia and currently lack any drugs officially sanctioned for treatment?,"[27860, 31796, 33196, 33397, 27764, 33052, 30507, 30419, 31540, 31987, 29070, 33189, 32107, 27292, 31168, 38562, 30748, 38678, 29113, 38564]","[27860, 31796, 33196, 33397, 27764, 33052, 30507, 30419, 31540, 31987, 29070, 33189, 32107, 27292, 31168, 38562, 30748, 38678, 29113, 38564]"
143,[39067],"What disease functions as a parent and child condition in the hierarchy of autoinflammatory disorders, linking both pyogenic bacterial infections with amylopectinosis and PLCG2-associated antibody deficiency and immune dysregulation?","[39067, 39119, 39783, 29594, 29059, 98425, 36131, 29490, 95092, 32202, 29607, 38453, 38481, 30937, 35438, 38732, 38204, 29344, 99680, 38168]","[39067, 39119, 39783, 29594, 29059, 98425, 36131, 29490, 95092, 32202, 29607, 38453, 38481, 30937, 35438, 38732, 38204, 29344, 99680, 38168]"
4434,[20612],Could you recommend a medication for hemorrhoids treatment with a molecular weight near 340 units?,"[20612, 14028, 20193, 20322, 14042, 15003, 20438, 14680, 14940, 14881, 20254, 20447, 20314, 20417, 14384, 21030, 20993, 15125, 16289, 16638]","[14940, 20612, 20193, 14028, 15125, 15003, 14384, 14042, 14881, 20993, 14680, 20417, 20254, 20447, 20322, 21030, 20438, 20314, 16289, 16638]"
7043,[1106],Search for genes or proteins that interact with ATG2B and share an association with a common disease.,"[454, 1048, 3666, 6716, 7569, 7041, 7792, 7457, 1131, 7489, 5597, 9034, 7061, 10527, 6661, 59490, 8634, 60450, 5108, 13443]","[454, 1048, 3666, 6716, 7569, 7041, 7792, 7457, 1131, 7489, 5597, 9034, 7061, 10527, 6661, 59490, 8634, 60450, 5108, 13443]"
8477,[10542],Which gene or protein is consistently non-expressed or missing in the adult mammalian renal system as well as the mammalian vulvar tissue?,"[77246, 3846, 34415, 57891, 7324, 10631, 7280, 60599, 77350, 13241, 6707, 13588, 3643, 35356, 8230, 79070, 36, 13281, 5158, 79317]","[77246, 3846, 34415, 57891, 7324, 10631, 7280, 60599, 77350, 13241, 6707, 13588, 3643, 35356, 8230, 79070, 36, 13281, 5158, 79317]"
933,[18825],What drugs are known to primarily target the DCPS gene/protein in their mechanism of action?,"[18185, 18184, 18825, 18823, 18826, 18824, 17737, 18822, 17731, 17732, 17738, 17734, 17733, 17736, 17728, 14460, 15350, 14178, 17665, 14186]","[18185, 18184, 18825, 18823, 18826, 18824, 17737, 18822, 17731, 17732, 17738, 17734, 17733, 17736, 17728, 14460, 15350, 14178, 17665, 14186]"
5152,[62390],What signaling pathway is connected to the 'Neuronal System' pathway and controls the stability of neurons' resting membrane potential?,"[62364, 62365, 62359, 62833, 62390, 62363, 62690, 62719, 127637, 128392, 63073, 62706, 129303, 62731, 62385, 128553, 127975, 128458, 128286, 62716]","[62364, 62365, 62359, 62833, 62390, 62363, 62690, 62719, 127637, 128392, 63073, 62706, 129303, 62731, 62385, 128553, 127975, 128458, 128286, 62716]"
4996,[31570],Which condition involves a posterior polar cataract in its symptoms and is linked to the ITM2B gene?,"[30103, 31570, 30929, 27158, 31925, 27250, 30800, 30826, 27220, 30382, 37629, 27527, 32727, 32692, 36265, 30781, 36326, 29671, 29991, 29688]","[30103, 31570, 30929, 27158, 31925, 27250, 30800, 30826, 27220, 30382, 37629, 27527, 32727, 32692, 36265, 30781, 36326, 29671, 29991, 29688]"
9516,"[33894, 12713, 8458, 3916, 3181, 13455, 3419, 10133, 10647, 34107, 3484, 3901, 34398, 11771]",Which liver-expressed transporter gene or protein is involved in organic ion translocation and facilitates the movement of drugs that exhibit synergistic effects with 1-Testosterone?,"[10647, 10133, 13509, 33894, 12713, 11881, 5481, 34016, 5385, 59793, 56673, 35300, 56655, 56616, 1432, 59380, 3484, 6695, 34107, 13098]","[10647, 10133, 13509, 33894, 12713, 11881, 5481, 34016, 5385, 59793, 56673, 35300, 56655, 56616, 1432, 59380, 3484, 6695, 34107, 13098]"
5631,"[5664, 12353, 57287, 57898, 13839, 12272, 57875, 7860, 9014, 34360, 57407, 671]","What genes or proteins interact with the tubulin C-terminal post-translational modification pathway, bind to tubulin, and exhibit tubulin-glutamic acid ligase activity?","[5664, 7860, 12272, 9014, 4410, 12667, 12353, 57875, 57898, 57287, 34360, 34474, 10269, 58637, 4719, 57900, 58639, 6947, 671, 5942]","[5664, 7860, 12272, 9014, 4410, 12667, 12353, 57875, 57898, 57287, 34360, 34474, 10269, 58637, 4719, 57900, 58639, 6947, 671, 5942]"
7313,[1057],"Identify genes or proteins that (1) engage in interaction with TBK1, (2) are linked to the same pathology as TBK1, and (3) are capable of interacting with protein kinase B alpha (AKT1).","[1057, 7286, 4784, 34562, 8241, 7488, 5589, 6426, 2409, 9539, 8779, 13834, 2097, 34742, 3380, 6866, 6773, 676, 57923, 57454]","[1057, 7286, 4784, 34562, 8241, 7488, 5589, 6426, 2409, 9539, 8779, 13834, 2097, 34742, 3380, 6866, 6773, 676, 57923, 57454]"
8753,[14586],Are there any pharmacological agents that act as electron donors in metabolic processes through reversible oxidation and reduction and influence genes or proteins associated with L-aminoadipate-semialdehyde dehydrogenase enzymatic function?,"[14681, 14586, 15270, 16562, 16082, 20099, 15928, 19501, 16248, 16225, 14889, 19550, 17118, 14877, 16561, 19957, 17169, 17401, 17375, 17094]","[14681, 14586, 15270, 16562, 16082, 20099, 15928, 19501, 16248, 16225, 14889, 19550, 17118, 14877, 16561, 19957, 17169, 17401, 17375, 17094]"
6117,[111],"Could you identify the common genetic targets for both N-(M-Trifluoromethylphenyl) Phenoxazine-4,6-Dicarboxylic Acid and (2S)-3-[(9H-fluoren-9-ylideneamino)oxy]-2-methylpropanoic acid?","[197, 1986, 2165, 363, 3282, 8192, 40, 1650, 6705, 1831, 29, 2043, 4425, 10997, 1815, 9917, 8974, 4569, 8300, 22092]","[40, 1986, 197, 2043, 363, 29, 8974, 1815, 1831, 4425, 2165, 3282, 8192, 6705, 10997, 1650, 9917, 22092, 4569, 8300]"
5285,[35260],"Please find genes or proteins with structural molecular activity linked to the basal body-plasma membrane anchoring pathway, particularly those interacting with NPHP1, suggesting involvement in a common signaling pathway.","[3424, 6921, 7280, 627, 61461, 10789, 57292, 10254, 60558, 59348, 4689, 13056, 9746, 949, 1698, 7103, 59915, 35260, 34412, 61343]","[3424, 6921, 7280, 627, 61461, 10789, 57292, 10254, 60558, 59348, 4689, 13056, 9746, 949, 1698, 7103, 59915, 35260, 34412, 61343]"
1722,[97962],What could be a related disease if someone has oromandibular-limb hypogenesis syndrome and a fibrous band linking their tongue to the palate or gingival ridge?,"[31207, 30641, 32528, 29032, 28133, 27621, 28032, 32527, 28250, 27672, 31315, 30959, 28996, 30330, 32725, 38131, 97962, 39152, 98029, 35513]","[31207, 30641, 32528, 29032, 28133, 27621, 28032, 32527, 28250, 27672, 31315, 30959, 28996, 30330, 32725, 38131, 97962, 39152, 98029, 35513]"
9257,[8503],What are the common genetic targets of Meclofenamic acid and Escherichia coli-derived Asparaginase?,"[22077, 3321, 13003, 11324, 7834, 34835, 4569, 10216, 4531, 81559, 3793, 13472, 7234, 1721, 3241, 78993, 57933, 82586, 81488, 79271]","[22077, 3321, 13003, 11324, 7834, 34835, 4569, 10216, 4531, 81559, 3793, 13472, 7234, 1721, 3241, 78993, 57933, 82586, 81488, 79271]"
5881,[111],"What are the common genetic targets associated with the action of both 2',4'-Dichloro-4-hydroxy-1,1'-biphenyl-3-carboxylic acid and Liotrix?","[29, 2805, 6108, 197, 5137, 1815, 12334, 1611, 2505, 2160, 2850, 2021, 1441, 6067, 4985, 7368, 11513, 6543, 13807, 8414]","[29, 2805, 6108, 197, 5137, 1815, 12334, 1611, 2505, 2160, 2850, 2021, 1441, 6067, 4985, 7368, 11513, 6543, 13807, 8414]"
5236,[13699],Could you supply a list of gene or protein regulators involved in ATPase activity that are also associated with the development of autism?,"[9254, 34379, 2037, 34388, 1955, 6177, 13718, 6214, 5462, 10094, 730, 12539, 34383, 10661, 10120, 78028, 80636, 97, 2820, 6962]","[34379, 1955, 2820, 97, 2037, 10120, 10661, 9254, 34383, 10094, 12539, 34388, 730, 6214, 6177, 13718, 5462, 78028, 80636, 6962]"
6960,[457],Which gene or protein is not expressed in either the salivary glands or the renal nephron's tubular structures?,"[79070, 79462, 3470, 7280, 3424, 13631, 5188, 10195, 1672, 7568, 56562, 1781, 13375, 11428, 5581, 10798, 13733, 13413, 9466, 9703]","[1781, 13631, 7568, 9703, 10798, 1672, 3424, 79462, 5188, 3470, 9466, 56562, 13375, 13733, 79070, 11428, 10195, 7280, 13413, 5581]"
5574,[18132],Which strobilurin fungicides target both CYC1 and UQCRB genes/proteins?,"[18132, 16539, 18133, 18131, 18137, 18136, 18134, 18138, 18135, 18287, 20105, 18296, 15993, 15242, 18297, 21558, 20896, 16318, 19525, 14190]","[18132, 16539, 18133, 18131, 18137, 18136, 18134, 18138, 18135, 18287, 20105, 18296, 15993, 15242, 18297, 21558, 20896, 16318, 19525, 14190]"
139,[29819],"Can you list the diseases associated with the PDE8B gene, specifically those that fall under primary pigmented nodular adrenocortical disease with a known PDE11A gene mutation etiology?","[27472, 29819, 38513, 35510, 30162, 38003, 27160, 27390, 30202, 27933, 37703, 27861, 30917, 83760, 31046, 30003, 30758, 32943, 30698, 33099]","[27472, 29819, 38513, 35510, 30162, 38003, 27160, 27390, 30202, 27933, 37703, 27861, 30917, 83760, 31046, 30003, 30758, 32943, 30698, 33099]"
1893,[95859],Which diseases are related to or fall under oophoritis and also manifest with tuberculous inflammation of the ovaries?,"[95859, 95421, 36424, 99072, 35638, 36068, 35555, 29924, 35446, 94644, 36043, 96612, 33560, 99645, 35840, 95172, 37161, 84054, 96102, 95582]","[95859, 95421, 36424, 99072, 35638, 36068, 35555, 29924, 35446, 94644, 36043, 96612, 33560, 99645, 35840, 95172, 37161, 84054, 96102, 95582]"
10411,[13398],Which genes or proteins are expressed in the pericardium but not in the deltoid muscle?,"[2773, 3387, 61, 1403, 704, 2500, 13628, 10833, 652, 3225, 1532, 13398, 9724, 3721, 2417, 6826, 13349, 3212, 1256, 56752]","[61, 13398, 1532, 704, 3225, 2773, 1403, 3212, 10833, 13349, 13628, 3387, 2417, 2500, 652, 9724, 56752, 3721, 6826, 1256]"
1595,[20210],Could you provide a list of medications that are compatible with Ormeloxifene for treating a respiratory infection?,"[14427, 14213, 14451, 14370, 15191, 21446, 15190, 15377, 14935, 14785, 14291, 14615, 15644, 15568, 15532, 20732, 15318, 15464, 21404, 15381]","[15532, 14935, 14615, 20732, 14785, 14427, 15191, 14370, 14213, 14291, 15568, 21404, 14451, 15644, 15190, 21446, 15377, 15464, 15318, 15381]"
