id,ground_truths,query,original_answers,reranked_answers
6517,"[56241, 55842, 56174, 56263]",Which cell structures are involved in interaction with genes or proteins that are influenced by the medication Travoprost?,"[56174, 56241, 56263, 55842, 56436, 56160, 125004, 56073, 55517, 125753, 124249, 56175, 56432, 127233, 125844, 127330, 124748, 124643, 124443, 55662]","[56174, 56241, 56263, 55842, 56436, 56160, 125004, 56073, 55517, 125753, 124249, 56175, 56432, 127233, 125844, 127330, 124748, 124643, 124443, 55662]"
9996,[10833],Which genes or proteins are expressed exclusively in the pericardium and not in either the dorsal or ventral regions of the thalamus?,"[61, 3387, 1403, 2773, 704, 10833, 2500, 1532, 13628, 3225, 13398, 652, 9724, 79070, 56752, 6424, 35014, 4348, 3624, 9005]","[61, 704, 10833, 3225, 1532, 9005, 652, 13628, 2500, 3387, 9724, 56752, 2773, 13398, 4348, 1403, 6424, 3624, 79070, 35014]"
3630,[15179],Could you suggest any medications effective for treating beriberi that are safe to use with Zopiclone?,"[14880, 20293, 15179, 15885, 20497, 14706, 14106, 14132, 20320, 14982, 14609, 15441, 15099, 15570, 17318, 15319, 15090, 15534, 14893, 14137]","[14880, 20293, 15179, 15885, 20497, 14706, 14106, 14132, 20320, 14982, 14609, 15441, 15099, 15570, 17318, 15319, 15090, 15534, 14893, 14137]"
10252,"[43, 2140]",Which gene or protein responsible for coding the regulatory component of PI3K is known to engage with elements of the pathways for FGFR1c and Klotho complex signal transduction?,"[13070, 43, 1641, 150, 1332, 12380, 152, 2689, 33909, 6468, 2821, 799, 2036, 13271, 9004, 2140, 2447, 57057, 34410, 2050]","[43, 1641, 2140, 2447, 152, 2036, 13070, 799, 2050, 34410, 2821, 33909, 1332, 13271, 2689, 6468, 12380, 9004, 57057, 150]"
5142,[30638],Which autosomal dominant diseases are linked to the development of supernumerary breast tissue?,"[32617, 28347, 28240, 33525, 30670, 30894, 28346, 29934, 27680, 30516, 32339, 28086, 30978, 31798, 27714, 38395, 30638, 38422, 29485, 30770]","[32617, 30638, 28347, 38395, 28240, 29485, 28346, 28086, 30670, 30516, 29934, 33525, 30894, 30770, 30978, 38422, 27714, 31798, 27680, 32339]"
1755,[62592],"Please find a metabolic process that either precedes or follows hyaluronan absorption and breakdown, and is involved in its metabolism or signaling cascades.","[47408, 106871, 106670, 45556, 47288, 40864, 48983, 40488, 45126, 100813, 100733, 41134, 50160, 110220, 110219, 45341, 43715, 108543, 48335, 45352]","[106871, 47408, 106670, 40488, 40864, 100813, 47288, 100733, 45341, 45352, 48335, 50160, 45556, 45126, 43715, 110219, 48983, 110220, 41134, 108543]"
5686,[59232],Please find genes or proteins that bind to clathrin and also interact with the FAT3 protein.,"[2582, 59232, 2213, 2995, 5990, 1110, 8703, 7017, 4378, 11933, 58662, 8133, 7115, 4011, 4495, 13665, 2106, 3896, 3655, 9942]","[59232, 2582, 2213, 1110, 2995, 4378, 8703, 3896, 3655, 7017, 5990, 4495, 8133, 4011, 13665, 9942, 7115, 11933, 2106, 58662]"
7969,"[52067, 53456, 46931, 40628, 103931]",Which biological process shares a similar interaction pattern with genes or proteins to that of 7-methylguanosine cap hypermethylation?,"[42134, 112672, 51463, 43040, 42088, 40445, 104646, 53264, 109178, 101281, 52691, 51548, 43153, 43152, 40379, 103931, 114169, 106170, 52769, 46931]","[103931, 106170, 46931, 114169, 52769, 43152, 109178, 40379, 40445, 43153, 101281, 52691, 51548, 53264, 42134, 104646, 42088, 51463, 43040, 112672]"
6641,[18223],"Would you be able to provide information on whether the specified medication acts on genes or proteins that play a role in the signaling pathways of blood clotting receptors, particularly those associated with protein tyrosine kinase activator activity, given the importance of anticoagulation for specific medical conditions?","[17032, 14621, 14622, 14557, 14834, 16638, 14620, 15010, 16142, 16640, 16667, 15975, 16642, 16637, 16181, 19612, 15977, 19613, 15911, 16831]","[15010, 16667, 16640, 15977, 14620, 16642, 16181, 16831, 14834, 16637, 16142, 17032, 19612, 19613, 14557, 15975, 14622, 16638, 15911, 14621]"
10271,"[14330, 14505, 14508, 14512, 14522, 14141]",Identify a medication that shares a similar gene or protein carrier with Pegaspargase and is indicated for the treatment of neurological conditions.,"[14503, 21460, 17539, 21531, 21535, 16512, 19644, 21534, 14695, 21537, 15017, 20488, 21538, 21536, 21530, 15394, 21532, 21539, 17774, 16842]","[14503, 15394, 14695, 17539, 16842, 16512, 21537, 17774, 21539, 19644, 21530, 21531, 20488, 21535, 21536, 21532, 21538, 21534, 15017, 21460]"
10069,[111],"Identify the common genetic targets that interact with both N-[(2',4'-Difluoro-4-hydroxy-5-iodobiphenyl-3-yl)carbonyl]-beta-alanine and 2-(2,6-Dichlorophenyl)-1,3-benzoxazole-6-carboxylic acid.","[29, 2805, 5137, 12334, 2158, 6933, 40, 2043, 4640, 3282, 315, 7558, 9088, 1831, 5514, 8414, 11009, 2819, 6747, 413]","[40, 2043, 29, 1831, 5137, 12334, 5514, 2158, 6933, 2805, 7558, 315, 4640, 3282, 9088, 413, 8414, 6747, 2819, 11009]"
768,"[99105, 99106, 99107, 33271, 99109, 30376, 31629, 99247, 94839, 27609]",What diseases associated with chromosomal abnormalities can lead to stunted physical growth and cognitive impairments?,"[31095, 32741, 32500, 33445, 32768, 31413, 32092, 30178, 29926, 33291, 27376, 28411, 28859, 33006, 28492, 28783, 99734, 31944, 27330, 29921]","[32500, 27376, 28411, 31095, 32768, 33445, 27330, 29926, 33006, 31413, 28492, 28783, 31944, 29921, 32092, 33291, 32741, 30178, 28859, 99734]"
3093,"[31754, 27547, 38252]",What condition could be linked to FAM111A gene or protein modifications in individuals with bone sclerosis and denser long bones?,"[30565, 27547, 29180, 38252, 31754, 30423, 83869, 36999, 29646, 94638, 36634, 94637, 37115, 33643, 37327, 38162, 36201, 28774, 38425, 94914]","[38252, 27547, 31754, 29646, 37115, 30423, 36999, 83869, 36201, 94637, 94638, 38162, 36634, 37327, 33643, 28774, 29180, 30565, 38425, 94914]"
9732,"[45193, 47627, 50011, 103928, 112264]",Which biological processes share a similar interaction pattern with genes or proteins as the positive regulation of exoribonuclease activity is observed in?,"[41524, 106682, 48182, 39995, 103730, 106373, 51361, 46443, 51209, 108281, 40983, 44383, 40315, 104781, 48532, 50011, 48187, 43635, 107636, 111260]","[50011, 43635, 111260, 51361, 108281, 46443, 48187, 48532, 39995, 41524, 107636, 51209, 48182, 40983, 40315, 104781, 44383, 106373, 103730, 106682]"
6708,"[94418, 94210, 94316]",Which phenotypic manifestations or effects are associated with the subtype of acute biphenotypic leukemia?,"[94419, 94418, 94316, 94210, 86289, 26281, 25512, 22923, 24478, 33749, 22916, 22934, 22918, 84993, 24143, 94152, 94308, 85995, 94382, 23849]","[94419, 94152, 22934, 22923, 94308, 23849, 85995, 94382, 94418, 94210, 94316, 22916, 24143, 25512, 86289, 84993, 22918, 24478, 26281, 33749]"
5950,[27831],Identify conditions unresponsive to medication that correlate with increased liver iron levels.,"[29761, 30776, 28176, 30402, 28183, 27772, 29390, 28134, 27187, 33434, 31607, 30436, 35764, 35915, 33572, 29810, 98077, 35565, 36172, 35436]","[35565, 36172, 28176, 30436, 29810, 30776, 29761, 98077, 33434, 35436, 35764, 28134, 29390, 27772, 30402, 28183, 27187, 31607, 35915, 33572]"
11077,[29113],Find medical conditions linked to the gene SLC29A3 that should not be treated with the drug Goserelin.,"[27219, 28407, 36043, 27933, 30438, 37044, 35583, 36453, 38682, 37703, 33656, 31109, 33616, 83760, 33575, 99985, 35466, 29642, 83817, 29307]","[30438, 31109, 28407, 33616, 27219, 27933, 37703, 36453, 83760, 33575, 36043, 33656, 35583, 38682, 37044, 29642, 83817, 35466, 29307, 99985]"
4438,"[8034, 57603, 61258, 61259, 61260, 61261, 8878, 61262, 61263, 61264, 61265, 61266, 61267, 61268, 61269, 5874, 57658, 701]","I need to find a gene or protein that interacts with the cis-Golgi network and contributes to the organization of the Golgi apparatus. It should be involved in regulating Golgi structure and function specifically within the Golgi cis cisterna, the Golgi cisterna membrane, and the cis-Golgi network. Can you supply information on any genes or proteins that fit this description?","[6600, 12345, 701, 7115, 6508, 1542, 11119, 1433, 61263, 61262, 2653, 61258, 61264, 9056, 61269, 57603, 1415, 56666, 61267, 7528]","[56666, 61262, 61269, 57603, 61267, 61263, 61264, 61258, 701, 11119, 12345, 6508, 1415, 7528, 7115, 2653, 9056, 6600, 1542, 1433]"
5928,"[24225, 23564, 22757, 22759]",What are the observed effects or phenotypes associated with the subtype of hereditary papillary renal cell carcinoma?,"[24225, 86780, 88948, 94409, 24212, 24226, 86781, 22759, 23564, 22757, 85318, 25587, 87027, 27156, 85618, 88947, 86789, 90431, 86796, 94186]","[24225, 86780, 22757, 23564, 22759, 88947, 85618, 85318, 24212, 88948, 25587, 94409, 24226, 87027, 90431, 86781, 27156, 86789, 94186, 86796]"
8037,"[63952, 64778, 63235, 64876]",Which anatomical structures lack the expression of genes or proteins involved in the interaction with the organization of actin cytoskeleton in postsynaptic terminals?,"[64778, 63826, 63235, 66747, 67302, 63584, 64800, 63180, 64876, 64799, 64338, 63824, 63952, 63921, 63149, 64814, 63119, 63359, 63431, 64476]","[64778, 63826, 63235, 66747, 67302, 63584, 64800, 63180, 64876, 64799, 64338, 63824, 63952, 63921, 63149, 64814, 63119, 63359, 63431, 64476]"
4259,"[13664, 11205, 6887, 5448, 3145, 3147, 11641, 5884, 765]","Could you identify enzymes that bind metal ions, are active in protein polyubiquitination, and play a role in both Antigen processing through Ubiquitination and Proteasome degradation?",[],[]
3815,[37440],What conditions should be included in the differential diagnosis for a patient presenting with a breast carcinoma subtype linked to both invasive ductal carcinoma and cystic hypersecretory carcinoma?,"[37440, 96661, 36798, 97016, 37132, 96589, 96805, 36772, 95972, 97290, 97419, 96863, 39858, 37472, 96674, 96711, 96800, 37512, 99902, 98083]","[37440, 97016, 36798, 36772, 37132, 98083, 96661, 37512, 96674, 39858, 97290, 95972, 96800, 96863, 97419, 96805, 96589, 37472, 96711, 99902]"
5496,"[96249, 96941]",What are the diseases derived from cervical benign epithelial neoplasms?,"[94981, 39706, 96940, 96249, 35791, 96941, 37436, 95241, 36567, 36665, 35741, 37100, 36081, 98874, 99709, 37102, 97265, 36256, 36945, 35740]","[37102, 36567, 36081, 35791, 96249, 96941, 94981, 36665, 96940, 35740, 36256, 35741, 95241, 97265, 37100, 99709, 36945, 39706, 37436, 98874]"
5772,"[23162, 23915]",What are the observed effects or phenotypes associated with constrictive pericarditis subtypes?,"[91058, 84394, 22831, 22837, 22849, 84361, 84472, 89535, 26336, 86137, 23011, 88019, 25805, 84373, 25672, 86116, 84948, 23915, 86125, 86128]","[86116, 23915, 26336, 22831, 23011, 25672, 84361, 22849, 22837, 84472, 84373, 84948, 91058, 25805, 89535, 88019, 86137, 84394, 86128, 86125]"
10117,"[108356, 44625, 106193, 103667, 46101, 42615, 111482, 48219, 112316]",Could you identify the biological processes that are involved with or influenced by the gene or protein linked to Distal Sensory Impairment?,"[46521, 104775, 108746, 105547, 105247, 46384, 44676, 46231, 100676, 40405, 48102, 105242, 52563, 40585, 47510, 47425, 109925, 49957, 46873, 111174]","[46873, 47425, 40405, 49957, 46521, 104775, 109925, 47510, 52563, 48102, 111174, 105247, 105547, 44676, 40585, 46231, 46384, 108746, 100676, 105242]"
5699,[16019],"Can you give me a list of drugs that target the FLT4 gene/protein and also suppress inflammation, edema, and angiogenesis?","[15002, 15205, 15230, 16021, 15020, 16018, 16019, 15599, 15674, 15752, 16022, 14413, 14945, 16020, 14187, 18187, 16510, 16492, 14449, 14373]","[15002, 15205, 15230, 16021, 15020, 16018, 16019, 15599, 15674, 15752, 16022, 14413, 14945, 16020, 14187, 18187, 16510, 16492, 14449, 14373]"
7152,"[94307, 22349, 22335]",What are the observed effects or phenotypes associated specifically with the subtype of suppurative uveitis?,"[88772, 25843, 88762, 25844, 25415, 24425, 22400, 90597, 84469, 24423, 87212, 22343, 26090, 90605, 93118, 22335, 94307, 24416, 89983, 89008]","[94307, 84469, 22400, 22343, 22335, 25415, 90597, 25844, 24423, 90605, 87212, 26090, 93118, 88762, 88772, 24425, 25843, 89983, 24416, 89008]"
10551,[111],"Which genes encode proteins that interact with both O-Trifluoromethylphenyl Anthranilic Acid and N-(3,5-dibromo-4-hydroxyphenyl)benzamide as ligands?","[315, 1831, 9088, 5137, 197, 4688, 10385, 8877, 9181, 7621, 6705, 363, 9610, 5176, 9136, 8974, 9929, 22092, 5688, 10901]","[197, 363, 1831, 5137, 8974, 315, 9181, 10385, 9136, 8877, 4688, 10901, 9088, 5688, 7621, 6705, 5176, 9610, 9929, 22092]"
7224,[14558],"Which medication, facilitated by gene or protein interactions with the sarcolemma, exhibits minimal impact on blood gases, respiratory function, and the cardiovascular system?","[15077, 14136, 15502, 19617, 16310, 17217, 21009, 14228, 15962, 14422, 17647, 14869, 21885, 15350, 16008, 19612, 15312, 16716, 17532, 18235]","[15077, 14136, 15502, 19617, 16310, 17217, 21009, 14228, 15962, 14422, 17647, 14869, 21885, 15350, 16008, 19612, 15312, 16716, 17532, 18235]"
2287,[39750],What diseases are subclassified under secondary malignant neoplasms and have metastatic potential?,"[39750, 39751, 36496, 39748, 37619, 84263, 39749, 35612, 99925, 37682, 99926, 83825, 37498, 36701, 36936, 97069, 35633, 99581, 35727, 35468]","[36496, 39748, 39750, 37619, 39749, 35612, 39751, 35633, 99925, 37498, 83825, 97069, 99926, 84263, 35727, 37682, 99581, 35468, 36936, 36701]"
1804,[12390],"Please find me genes or proteins linked to pediatric liver cancer, interacting with PAXIP1, highly expressed in lung adenocarcinoma, with a nuclear signal and similarity to GAGE/PAGE proteins.","[12390, 8289, 5558, 42, 2037, 223, 3807, 505, 3008, 33983, 9249, 5240, 33995, 6426, 177, 11730, 5164, 12752, 7884, 56863]","[12390, 5164, 177, 2037, 3008, 5558, 505, 6426, 5240, 3807, 42, 8289, 223, 33995, 33983, 7884, 9249, 11730, 12752, 56863]"
1989,[32731],"What possible conditions could I have that are linked to or similar to uniparental disomy of chromosome X, particularly if this led to me inheriting two copies of a recessive gene from my mother?","[32731, 32724, 98770, 98771, 39314, 98769, 33160, 98789, 32679, 39268, 32675, 32677, 33161, 32678, 32667, 98862, 38952, 99759, 98775, 98774]","[32731, 32724, 39314, 39268, 38952, 98769, 98770, 32675, 98771, 33160, 32679, 32677, 32678, 98774, 98789, 33161, 32667, 98775, 98862, 99759]"
4242,[14844],Can you recommend medications that treat both eosinophilic pneumonia and a parasitic worm infection?,"[18799, 14844, 19177, 14019, 14023, 14030, 14320, 14269, 18798, 14024, 15003, 14028, 14042, 15307, 18028, 15450, 15644, 14698, 15365, 15647]","[18799, 14844, 19177, 14019, 14023, 14030, 14320, 14269, 18798, 14024, 15003, 14028, 14042, 15307, 18028, 15450, 15644, 14698, 15365, 15647]"
2080,[15572],What are the recommended medications for managing BCR-ABL1 positive blast phase CML?,"[14794, 15572, 15030, 15187, 15970, 14207, 15429, 15805, 15134, 14849, 14780, 19886, 20473, 14955, 14194, 19620, 15748, 14450, 15750, 21500]","[14794, 15572, 15030, 15187, 15970, 14207, 15429, 15805, 15134, 14849, 14780, 19886, 20473, 14955, 14194, 19620, 15748, 14450, 15750, 21500]"
3755,[31517],What hereditary diseases are associated with the HLA-C gene?,"[31517, 30654, 33621, 29929, 37805, 84303, 39524, 30075, 28313, 83800, 38024, 39728, 36712, 30494, 33295, 39870, 30299, 35438, 28543, 28896]","[31517, 28313, 83800, 30654, 29929, 33621, 38024, 39728, 30075, 39524, 84303, 33295, 36712, 37805, 30299, 39870, 30494, 35438, 28896, 28543]"
6457,[27434],"Could you provide a list of disorders characterized by both an absence of approved medications and a connection to atypical cardiac structures, which also result in skin that is prone to blistering and tearing with minimal trauma?","[29359, 28150, 27687, 27434, 31663, 31133, 33042, 31543, 27643, 27640, 33283, 27638, 32299, 27639, 29474, 37715, 28955, 30505, 28178, 30099]","[27434, 27640, 27638, 31133, 33042, 30099, 27639, 31663, 28178, 27687, 28150, 29359, 37715, 29474, 32299, 28955, 30505, 27643, 33283, 31543]"
2354,[39682],"What related conditions or potential diseases might be associated with ""benign neoplasm of hard palate"" and ""oral cavity neoplasm""? Can you provide a hierarchy or connections of these illnesses?","[39682, 37555, 99008, 98997, 37723, 36750, 37554, 35829, 36643, 39673, 98971, 37562, 98969, 37945, 39838, 98996, 37553, 36051, 99009, 37552]","[99008, 37555, 39682, 37723, 39673, 36750, 98971, 37554, 36643, 98997, 35829, 39838, 99009, 37562, 37945, 36051, 98969, 37552, 98996, 37553]"
10857,[9967],Which genes or proteins are found to be expressed in cartilage but not detected in the parietal lobe of the brain?,"[9967, 792, 5784, 22, 1458, 721, 2863, 12046, 3143, 885, 1454, 34038, 349, 2057, 8293, 35149, 5408, 79070, 8384, 11985]","[9967, 22, 35149, 2057, 349, 5784, 5408, 3143, 1454, 721, 885, 12046, 792, 1458, 8293, 8384, 34038, 2863, 11985, 79070]"
6655,"[66747, 64863, 64876, 63824, 64512]",Which anatomical structures lack the genetic or proteomic expression linked to infertility?,"[64427, 63466, 63235, 65138, 66760, 64799, 64476, 63584, 63826, 63149, 63680, 65509, 64312, 64778, 64338, 63112, 63379, 67116, 66826, 63376]","[64427, 63466, 63235, 65138, 66760, 64799, 64476, 63584, 63826, 63149, 63680, 65509, 64312, 64778, 64338, 63112, 63379, 67116, 66826, 63376]"
6280,[14313],Which pharmaceutical compounds are designed to modulate gene or protein activities associated with SUMO-conjugation system interactions?,"[17532, 18548, 18483, 18180, 16926, 18628, 16870, 21647, 19370, 14065, 14449, 17107, 20266, 16903, 16515, 18519, 18622, 19989, 17823, 21690]","[18519, 17823, 19370, 16926, 16903, 18622, 18628, 18548, 16870, 14065, 18483, 14449, 19989, 17107, 20266, 16515, 17532, 18180, 21647, 21690]"
7718,"[63952, 63826]",Which anatomical structures lack the expression of genes or proteins involved in the interaction with the formation of the endoplasmic reticulum's tubular network?,"[63826, 63824, 66747, 63180, 63235, 65509, 63466, 64778, 67302, 64799, 63921, 63680, 64876, 64512, 65138, 66841, 64814, 63173, 64551, 63372]","[63826, 63824, 66747, 63180, 63235, 65509, 63466, 64778, 67302, 64799, 63921, 63680, 64876, 64512, 65138, 66841, 64814, 63173, 64551, 63372]"
1152,"[2017, 5098, 1004, 8432, 3774]","Please find the gene associated with multiple sclerosis pathogenesis that codes for a receptor on antigen-presenting cells, essential for various immune and inflammatory responses.","[33914, 11310, 10320, 10600, 1573, 11236, 6666, 4694, 4086, 34427, 5683, 12302, 59253, 5098, 4866, 4827, 58705, 5756, 5579, 4575]","[33914, 11310, 10320, 10600, 1573, 11236, 6666, 4694, 4086, 34427, 5683, 12302, 59253, 5098, 4866, 4827, 58705, 5756, 5579, 4575]"
7918,[30035],Find health conditions linked to Fatty Acid Binding Protein 2 (FABP2) that should not be managed with the use of Oxymorphone.,"[83916, 36603, 83910, 30035, 35790, 36693, 35764, 35565, 35961, 33605, 36080, 30602, 38066, 27878, 83762, 37753, 94782, 98468, 84242, 33593]","[83916, 36603, 83910, 30035, 35790, 36693, 35764, 35565, 35961, 33605, 36080, 30602, 38066, 27878, 83762, 37753, 94782, 98468, 84242, 33593]"
233,[5843],"What is the name of the gene or protein that binds with molecules involved in protein binding, attaches to protein C-termini, contributes to pore complex assembly, and modulates ion transport across membranes in host-pathogen interactions?","[5843, 1534, 1207, 3356, 12106, 10108, 6133, 6066, 4054, 57491, 2251, 572, 56597, 1393, 7547, 60514, 60522, 6971, 826, 57897]","[5843, 1534, 1207, 3356, 12106, 10108, 6133, 6066, 4054, 57491, 2251, 572, 56597, 1393, 7547, 60514, 60522, 6971, 826, 57897]"
5649,[31427],"Is my joint pain, stiffness, and swelling indicative of a hereditary vascular condition?","[32478, 31821, 33151, 32727, 32785, 32325, 32728, 28257, 32692, 29078, 32964, 27630, 27399, 28099, 32716, 28242, 95803, 31156, 31789, 98151]","[28242, 29078, 28257, 31156, 32325, 95803, 32727, 32692, 98151, 32728, 31789, 27630, 27399, 31821, 28099, 32785, 32716, 33151, 32964, 32478]"
2152,[36119],"Could you provide information on hereditary diseases associated with bladder stone formation? My mother previously experienced bladder issues, and I'm concerned about the familial risk.","[37618, 97798, 95505, 95508, 83950, 36119, 27425, 38487, 30970, 97761, 28085, 37739, 29627, 36181, 95504, 31756, 36217, 95483, 98599, 96646]","[97798, 28085, 27425, 30970, 37618, 31756, 36119, 83950, 37739, 36181, 95483, 36217, 95508, 95505, 95504, 38487, 29627, 96646, 97761, 98599]"
7287,"[56263, 55719, 56362, 55534, 55952, 56436, 126196, 124474]",Which cellular structures or organelles are associated with the interaction of genes or proteins affected by Thonzonium Bromide?,"[56073, 56040, 55943, 55944, 56241, 56207, 56278, 124249, 56160, 56436, 126206, 127433, 55522, 55767, 56263, 56086, 126604, 126913, 125956, 56067]","[56073, 56040, 55943, 55944, 56241, 56207, 56278, 124249, 56160, 56436, 126206, 127433, 55522, 55767, 56263, 56086, 126604, 126913, 125956, 56067]"
10604,"[56073, 126963, 126196, 56436, 55898]",Which cellular structures engage with the genetic elements or proteins affected by the actions of D-Eritadenine?,"[56073, 56436, 126196, 126963, 56263, 56241, 55522, 56160, 55898, 125263, 55725, 56223, 56174, 125013, 56063, 55638, 125302, 126913, 56411, 56086]","[55522, 56174, 56263, 56436, 126196, 55725, 56241, 56073, 125013, 56223, 56160, 56086, 56063, 55898, 126963, 56411, 126913, 55638, 125263, 125302]"
2045,"[62836, 127726, 127727]","Please find a pathway that falls under the Defensins hierarchy, involves antimicrobial protein functions, and is externally peer-reviewed.","[62836, 62401, 127727, 127726, 62487, 62475, 127888, 127886, 62522, 62489, 62500, 62499, 127866, 62775, 62376, 128837, 129227, 127652, 127683, 62387]","[62401, 62836, 127726, 127727, 128837, 127886, 127652, 129227, 127888, 62376, 62487, 62489, 62500, 62775, 62475, 127866, 62522, 62499, 62387, 127683]"
5992,"[5385, 8618, 3484]",Is there evidence to suggest that the gene or protein responsible for organic cation transport also facilitates the translocation of pharmaceuticals that exhibit synergistic effects when combined with Sulfathiazole?,"[33918, 3419, 3181, 3209, 56673, 4152, 9525, 1573, 490, 4985, 8428, 150, 8354, 2850, 2108, 5481, 35316, 59797, 11881, 59369]","[33918, 3419, 3181, 3209, 56673, 4152, 9525, 1573, 490, 4985, 8428, 150, 8354, 2850, 2108, 5481, 35316, 59797, 11881, 59369]"
7490,[83828],Which neonatal gastrointestinal illness resulting in severe intestinal harm and necrosis should not be treated with medication typically prescribed for Pasteurella multocida due to contraindications?,"[33449, 27468, 30184, 27286, 38392, 29494, 35961, 32977, 35565, 36229, 36104, 84001, 35760, 36707, 27292, 83828, 33306, 84114, 39058, 27203]","[33449, 27468, 30184, 27286, 38392, 29494, 35961, 32977, 35565, 36229, 36104, 84001, 35760, 36707, 27292, 83828, 33306, 84114, 39058, 27203]"
7168,"[38040, 33598, 35909, 30382]",Which illness leading to cerebral infarction would render medications for prolactin-secreting pituitary tumors inadvisable?,"[30382, 38040, 36312, 33598, 28998, 35909, 32930, 32939, 38476, 32563, 28829, 32673, 29118, 32123, 31908, 29637, 32738, 38086, 84023, 39081]","[29637, 32738, 38040, 38086, 30382, 39081, 35909, 84023, 33598, 36312, 32939, 28998, 32673, 38476, 32930, 31908, 29118, 32563, 28829, 32123]"
9133,[2711],Identify a gene or protein with the capability to interact with FOXC1 and shares an association with a similar effect or phenotype.,"[7682, 6601, 22026, 3000, 22020, 10918, 7456, 4486, 795, 708, 22011, 2711, 3879, 150, 6329, 13054, 5609, 57266, 4925, 12260]","[7682, 6601, 22026, 3000, 22020, 10918, 7456, 4486, 795, 708, 22011, 2711, 3879, 150, 6329, 13054, 5609, 57266, 4925, 12260]"
2635,"[16041, 14554]","Could you recommend a medication designed for Laron syndrome, specifically a synthetic version of the human insulin-like growth factor 1?","[14554, 16041, 14269, 15003, 14023, 14028, 14019, 14320, 15050, 14024, 14030, 15055, 14042, 14784, 15180, 17954, 17952, 15017, 17951, 20647]","[14554, 16041, 14269, 15003, 14023, 14028, 14019, 14320, 15050, 14024, 14030, 15055, 14042, 14784, 15180, 17954, 17952, 15017, 17951, 20647]"
5820,[111],"Identify the common genetic targets that interact with both 3',5'-Dinitro-N-Acetyl-L-Thyronine and 3-({[(1Z)-(2-methoxyphenyl)methylidene]amino}oxy)propanoic acid.","[4153, 35186, 33915, 6739, 35209, 58002, 22092, 34634, 7096, 2668, 6747, 6984, 3509, 1253, 10155, 6469, 34717, 1611, 8974, 34348]","[4153, 35186, 33915, 6739, 35209, 58002, 22092, 34634, 7096, 2668, 6747, 6984, 3509, 1253, 10155, 6469, 34717, 1611, 8974, 34348]"
5376,[128428],Can you find a pathway influencing organelle acid-base balance that operates before or after the 'Transport of inorganic cations/anions and amino acids/oligopeptides' pathway?,"[128425, 128433, 128432, 128431, 62710, 128426, 128428, 128430, 128429, 62712, 128427, 62708, 62763, 128420, 128423, 62707, 128437, 128436, 128551, 128347]","[62708, 128427, 128429, 128431, 128430, 128426, 62712, 62710, 128432, 128428, 128425, 128437, 128433, 62707, 128420, 62763, 128551, 128436, 128423, 128347]"
8511,"[18840, 19384]",Could you identify any stable compounds listed in DrugBank with experimental evidence that act upon genes or proteins associated with peptidyl-asparagine 3-dioxygenase enzymatic function?,"[14646, 18622, 19074, 20121, 19034, 16300, 19741, 17323, 18533, 19076, 14563, 17794, 18245, 19833, 18247, 18725, 18560, 19040, 18489, 18783]","[18622, 18245, 19074, 16300, 19034, 18247, 19076, 19040, 17323, 18533, 18560, 18489, 18725, 18783, 19833, 19741, 20121, 17794, 14563, 14646]"
